公文名称,发文日期,文号,正文链接
国家林业局办公室关于印发《国家林业局2009年政府信息公开年度报告》的通知,2010-07-02,办发字〔2010〕48号,http://www.forestry.gov.cn/sites/main/main/gov/content.jsp?TID=1751
关于贯彻落实中央林业工作会议精神的通知,2009-07-24,林办发〔2009〕167号,http://www.forestry.gov.cn/sites/main/main/gov/content.jsp?TID=1652
关于贯彻落实中央林业工作会议精神的通知,2009-07-24,林办发〔2009〕167号,http://www.forestry.gov.cn/sites/main/main/gov/content.jsp?TID=186
关于表彰全国退耕还林先进县、先进单位、先进个人、优秀农户的决定,2007-08-23,林退发〔2007〕174号,http://www.forestry.gov.cn/sites/main/main/gov/content.jsp?TID=1034
国家林业局关于表彰全国退耕还林先进县、先进单位、先进个人、优秀农户的决定,2007-08-23,林退发〔2007〕174号,http://www.forestry.gov.cn/sites/main/main/gov/content.jsp?TID=345
中共中央国务院关于加快林业发展的决定,2003-06-25,（２００３年６月２５日）,http://www.forestry.gov.cn/sites/main/main/gov/content.jsp?TID=630
